{
  "schema_version": "experiment5_roi_field_candidates_schema_v1",
  "chart_id": "KANE_R27",
  "candidate_source": "experiment5_roi_ocr_region_aware_field_matcher_v1_from_b1prime_v8",
  "region_profile": "T",
  "source_contract": {
    "source": "same_chart_human_confirmed_roi_ocr_text",
    "allows_human_confirmed_roi": true,
    "allows_ocr_bbox": false,
    "allows_chart_image_pixels": false,
    "allows_canonical_target": false,
    "allows_gold_observable_evidence": false
  },
  "leakage_policy": {
    "uses_canonical_target": false,
    "uses_expected_value": false,
    "uses_gold_field_to_leg_mapping": false,
    "uses_human_evidence_provenance": false,
    "uses_gold_observable_evidence": false,
    "uses_cifp_or_arinc_424": false,
    "uses_scorer_output": false
  },
  "field_candidates": {
    "fix_candidates": [
      {
        "value": "GEP",
        "field_type": "fix_ident",
        "source": "ocr_text",
        "source_region": "MISSED_APPROACH_TEXT",
        "source_section": "missed_approach_text",
        "source_snippet": "GEP",
        "source_start_char": null,
        "source_end_char": null,
        "region_local_start_char": null,
        "region_local_end_char": null,
        "global_start_char": null,
        "global_end_char": null,
        "rule_id": "admin_review_relation_fix_textualized_v1",
        "confidence": 0.96,
        "notes": "admin_review_relation_textualized"
      }
    ],
    "altitude_candidates": [
      {
        "value": 1110,
        "field_type": "altitude_ft",
        "source": "ocr_text",
        "source_region": "MISSED_APPROACH_TEXT",
        "source_section": "missed_approach_text",
        "source_snippet": "climb to 1110",
        "source_start_char": null,
        "source_end_char": null,
        "region_local_start_char": null,
        "region_local_end_char": null,
        "global_start_char": null,
        "global_end_char": null,
        "rule_id": "admin_review_relation_altitude_textualized_v1",
        "confidence": 0.96,
        "notes": "admin_review_relation_textualized"
      },
      {
        "value": 2700,
        "field_type": "altitude_ft",
        "source": "ocr_text",
        "source_region": "MISSED_APPROACH_TEXT",
        "source_section": "missed_approach_text",
        "source_snippet": "climb to 2700",
        "source_start_char": null,
        "source_end_char": null,
        "region_local_start_char": null,
        "region_local_end_char": null,
        "global_start_char": null,
        "global_end_char": null,
        "rule_id": "admin_review_relation_altitude_textualized_v1",
        "confidence": 0.96,
        "notes": "admin_review_relation_textualized"
      }
    ],
    "turn_candidates": [],
    "course_candidates": [],
    "hold_candidates": [],
    "instruction_snippets": [
      {
        "value": "on heading 268.8; climb to 2700 to GEP; hold at GEP, inbound course 085, right turns, 4 NM, maintain 2700.",
        "field_type": "missed_approach_instruction",
        "source": "ocr_text",
        "source_region": "MISSED_APPROACH_TEXT",
        "source_section": "missed_approach_text",
        "source_snippet": "MISSED APPROACH: on heading 268.8; climb to 2700 to GEP; hold at GEP, inbound course 085, right turns, 4 NM, maintain 2700.",
        "source_start_char": null,
        "source_end_char": null,
        "region_local_start_char": null,
        "region_local_end_char": null,
        "global_start_char": null,
        "global_end_char": null,
        "rule_id": "admin_relation_gold_ma_instruction_textualized_v1",
        "confidence": 0.98,
        "notes": "admin_relation_textualized_no_forbidden_keys_in_method_payload"
      }
    ],
    "track_to_fix_snippets": [],
    "route_sequence_snippets": [],
    "direct_phrase_snippets": [],
    "climb_phrase_snippets": [
      {
        "value": "climb to 1110",
        "field_type": "climb_phrase",
        "source": "ocr_text",
        "source_region": "MISSED_APPROACH_TEXT",
        "source_section": "missed_approach_text",
        "source_snippet": "climb to 1110",
        "source_start_char": null,
        "source_end_char": null,
        "region_local_start_char": null,
        "region_local_end_char": null,
        "global_start_char": null,
        "global_end_char": null,
        "rule_id": "admin_review_relation_climb_phrase_textualized_v1",
        "confidence": 0.9,
        "notes": "admin_review_relation_textualized"
      },
      {
        "value": "climb to 2700",
        "field_type": "climb_phrase",
        "source": "ocr_text",
        "source_region": "MISSED_APPROACH_TEXT",
        "source_section": "missed_approach_text",
        "source_snippet": "climb to 2700",
        "source_start_char": null,
        "source_end_char": null,
        "region_local_start_char": null,
        "region_local_end_char": null,
        "global_start_char": null,
        "global_end_char": null,
        "rule_id": "admin_review_relation_climb_phrase_textualized_v1",
        "confidence": 0.9,
        "notes": "admin_review_relation_textualized"
      }
    ]
  }
}
