{
  "candidate_source": "experiment5_roi_ocr_region_aware_field_matcher_v1_from_b1prime_v8",
  "chart_id": "KCBF_L36",
  "field_candidates": {
    "altitude_candidates": [
      {
        "confidence": 0.9,
        "field_type": "altitude_ft",
        "global_end_char": 53,
        "global_start_char": 49,
        "notes": "high_precision_missed_approach_procedure_context",
        "region_local_end_char": 30,
        "region_local_start_char": 26,
        "rule_id": "altitude_ft_regex_v8",
        "source": "ocr_text",
        "source_end_char": 53,
        "source_region": "MISSED_APPROACH_TEXT",
        "source_section": "missed_approach_text",
        "source_snippet": "MISSED APPROACH: Climb to 3000 then right turn direct OVR VORTAC and hold.",
        "source_start_char": 49,
        "value": 3000
      }
    ],
    "climb_phrase_snippets": [
      {
        "confidence": 0.9,
        "field_type": "climb_phrase",
        "global_end_char": 45,
        "global_start_char": 40,
        "notes": "high_precision_missed_approach_procedure_context",
        "region_local_end_char": 22,
        "region_local_start_char": 17,
        "rule_id": "climb_phrase_regex_v8",
        "source": "ocr_text",
        "source_end_char": 45,
        "source_region": "MISSED_APPROACH_TEXT",
        "source_section": "missed_approach_text",
        "source_snippet": "MISSED APPROACH: Climb to 3000 then right turn direct OVR VORTAC and hold.",
        "source_start_char": 40,
        "value": "MISSED APPROACH: Climb to 3000 then right turn direct OVR VORTAC and hold."
      }
    ],
    "course_candidates": [],
    "direct_phrase_snippets": [
      {
        "confidence": 0.9,
        "field_type": "direct_phrase",
        "global_end_char": 76,
        "global_start_char": 70,
        "notes": "high_precision_missed_approach_procedure_context",
        "region_local_end_char": 53,
        "region_local_start_char": 47,
        "rule_id": "direct_phrase_regex_v8",
        "source": "ocr_text",
        "source_end_char": 76,
        "source_region": "MISSED_APPROACH_TEXT",
        "source_section": "missed_approach_text",
        "source_snippet": "MISSED APPROACH: Climb to 3000 then right turn direct OVR VORTAC and hold.",
        "source_start_char": 70,
        "value": "MISSED APPROACH: Climb to 3000 then right turn direct OVR VORTAC and hold."
      }
    ],
    "fix_candidates": [
      {
        "confidence": 0.9,
        "field_type": "fix_ident",
        "global_end_char": 80,
        "global_start_char": 77,
        "notes": "high_precision_missed_approach_procedure_context",
        "region_local_end_char": 57,
        "region_local_start_char": 54,
        "rule_id": "fix_ident_token_regex_v8",
        "source": "ocr_text",
        "source_end_char": 80,
        "source_region": "MISSED_APPROACH_TEXT",
        "source_section": "missed_approach_text",
        "source_snippet": "MISSED APPROACH: Climb to 3000 then right turn direct OVR VORTAC and hold.",
        "source_start_char": 77,
        "value": "OVR"
      }
    ],
    "hold_candidates": [
      {
        "confidence": 0.9,
        "field_type": "hold_phrase",
        "global_end_char": 96,
        "global_start_char": 92,
        "notes": "high_precision_missed_approach_procedure_context",
        "region_local_end_char": 73,
        "region_local_start_char": 69,
        "rule_id": "hold_phrase_regex_v8",
        "source": "ocr_text",
        "source_end_char": 96,
        "source_region": "MISSED_APPROACH_TEXT",
        "source_section": "missed_approach_text",
        "source_snippet": "MISSED APPROACH: Climb to 3000 then right turn direct OVR VORTAC and hold.",
        "source_start_char": 92,
        "value": "MISSED APPROACH: Climb to 3000 then right turn direct OVR VORTAC and hold."
      }
    ],
    "instruction_snippets": [
      {
        "confidence": 0.95,
        "field_type": "missed_approach_instruction",
        "global_end_char": 97,
        "global_start_char": 40,
        "notes": "continuous_ocr_only_missed_approach_instruction_span_no_target_or_field_to_leg_linking",
        "region_local_end_char": 74,
        "region_local_start_char": 17,
        "rule_id": "missed_approach_instruction_span_regex_v8",
        "source": "ocr_text",
        "source_end_char": 97,
        "source_region": "MISSED_APPROACH_TEXT",
        "source_section": "missed_approach_text",
        "source_snippet": "Climb to 3000 then right turn direct OVR VORTAC and hold.",
        "source_start_char": 40,
        "value": "Climb to 3000 then right turn direct OVR VORTAC and hold."
      }
    ],
    "route_sequence_snippets": [],
    "track_to_fix_snippets": [],
    "turn_candidates": [
      {
        "confidence": 0.9,
        "field_type": "turn_direction",
        "global_end_char": 64,
        "global_start_char": 59,
        "notes": "high_precision_missed_approach_procedure_context",
        "region_local_end_char": 41,
        "region_local_start_char": 36,
        "rule_id": "turn_direction_regex_v8",
        "source": "ocr_text",
        "source_end_char": 64,
        "source_region": "MISSED_APPROACH_TEXT",
        "source_section": "missed_approach_text",
        "source_snippet": "MISSED APPROACH: Climb to 3000 then right turn direct OVR VORTAC and hold.",
        "source_start_char": 59,
        "value": "RIGHT"
      }
    ]
  },
  "leakage_policy": {
    "uses_canonical_target": false,
    "uses_cifp_or_arinc_424": false,
    "uses_expected_value": false,
    "uses_gold_field_to_leg_mapping": false,
    "uses_gold_observable_evidence": false,
    "uses_human_evidence_provenance": false,
    "uses_scorer_output": false
  },
  "region_profile": "T",
  "schema_version": "experiment5_roi_field_candidates_schema_v1",
  "source_contract": {
    "allows_canonical_target": false,
    "allows_chart_image_pixels": false,
    "allows_gold_observable_evidence": false,
    "allows_human_confirmed_roi": true,
    "allows_ocr_bbox": false,
    "source": "same_chart_human_confirmed_roi_ocr_text"
  }
}
