{
  "candidate_source": "experiment5_roi_ocr_region_aware_field_matcher_v1_from_b1prime_v8",
  "chart_id": "KCOI_R11",
  "field_candidates": {
    "altitude_candidates": [
      {
        "confidence": 0.25,
        "field_type": "altitude_ft",
        "global_end_char": 63,
        "global_start_char": 59,
        "notes": "weak_other_chart_text_candidate",
        "region_local_end_char": 19,
        "region_local_start_char": 15,
        "rule_id": "altitude_ft_regex_v8",
        "source": "ocr_text",
        "source_end_char": 63,
        "source_region": "MISSED_APPROACH_DETAIL_AREA",
        "source_section": "missed_approach_detail_area",
        "source_snippet": "ALTITUDE_TEXT: 3000 FIX_TEXT: MLB FIX_TEXT: YONUS FIX_SYMBOL",
        "source_start_char": 59,
        "value": 3000
      }
    ],
    "climb_phrase_snippets": [],
    "course_candidates": [],
    "direct_phrase_snippets": [],
    "fix_candidates": [],
    "hold_candidates": [],
    "instruction_snippets": [],
    "route_sequence_snippets": [],
    "track_to_fix_snippets": [],
    "turn_candidates": []
  },
  "leakage_policy": {
    "uses_canonical_target": false,
    "uses_cifp_or_arinc_424": false,
    "uses_expected_value": false,
    "uses_gold_field_to_leg_mapping": false,
    "uses_gold_observable_evidence": false,
    "uses_human_evidence_provenance": false,
    "uses_scorer_output": false
  },
  "region_profile": "PD",
  "schema_version": "experiment5_roi_field_candidates_schema_v1",
  "source_contract": {
    "allows_canonical_target": false,
    "allows_chart_image_pixels": false,
    "allows_gold_observable_evidence": false,
    "allows_human_confirmed_roi": true,
    "allows_ocr_bbox": false,
    "source": "same_chart_human_confirmed_roi_ocr_text"
  }
}
