{
  "candidate_source": "experiment5_roi_ocr_region_aware_field_matcher_v1_from_b1prime_v8",
  "chart_id": "KAMN_R18",
  "field_candidates": {
    "altitude_candidates": [
      {
        "confidence": 0.9,
        "field_type": "altitude_ft",
        "global_end_char": 77,
        "global_start_char": 73,
        "notes": "high_precision_missed_approach_procedure_context",
        "region_local_end_char": 54,
        "region_local_start_char": 50,
        "rule_id": "altitude_ft_regex_v8",
        "source": "ocr_text",
        "source_end_char": 77,
        "source_region": "MISSED_APPROACH_TEXT",
        "source_section": "missed_approach_text",
        "source_snippet": "MISSED APPROACH: APPROACH: Climbing right turn to 2800 direct and hold.",
        "source_start_char": 73,
        "value": 2800
      },
      {
        "confidence": 0.45,
        "field_type": "altitude_ft",
        "global_end_char": 159,
        "global_start_char": 155,
        "notes": "other_chart_text_procedure_word_context",
        "region_local_end_char": 19,
        "region_local_start_char": 15,
        "rule_id": "altitude_ft_regex_v8",
        "source": "ocr_text",
        "source_end_char": 159,
        "source_region": "MISSED_APPROACH_DETAIL_AREA",
        "source_section": "missed_approach_detail_area",
        "source_snippet": "ALTITUDE_TEXT: 2800 FIX_TEXT: OREYO CLIMB_ARROW CLIMB_ARROW FIX_SYMBOL",
        "source_start_char": 155,
        "value": 2800
      }
    ],
    "climb_phrase_snippets": [],
    "course_candidates": [],
    "direct_phrase_snippets": [
      {
        "confidence": 0.9,
        "field_type": "direct_phrase",
        "global_end_char": 84,
        "global_start_char": 78,
        "notes": "high_precision_missed_approach_procedure_context",
        "region_local_end_char": 61,
        "region_local_start_char": 55,
        "rule_id": "direct_phrase_regex_v8",
        "source": "ocr_text",
        "source_end_char": 84,
        "source_region": "MISSED_APPROACH_TEXT",
        "source_section": "missed_approach_text",
        "source_snippet": "MISSED APPROACH: APPROACH: Climbing right turn to 2800 direct and hold.",
        "source_start_char": 78,
        "value": "MISSED APPROACH: APPROACH: Climbing right turn to 2800 direct and hold."
      }
    ],
    "fix_candidates": [],
    "hold_candidates": [
      {
        "confidence": 0.9,
        "field_type": "hold_phrase",
        "global_end_char": 93,
        "global_start_char": 89,
        "notes": "high_precision_missed_approach_procedure_context",
        "region_local_end_char": 70,
        "region_local_start_char": 66,
        "rule_id": "hold_phrase_regex_v8",
        "source": "ocr_text",
        "source_end_char": 93,
        "source_region": "MISSED_APPROACH_TEXT",
        "source_section": "missed_approach_text",
        "source_snippet": "MISSED APPROACH: APPROACH: Climbing right turn to 2800 direct and hold.",
        "source_start_char": 89,
        "value": "MISSED APPROACH: APPROACH: Climbing right turn to 2800 direct and hold."
      }
    ],
    "instruction_snippets": [
      {
        "confidence": 0.95,
        "field_type": "missed_approach_instruction",
        "global_end_char": 94,
        "global_start_char": 65,
        "notes": "continuous_ocr_only_missed_approach_instruction_span_no_target_or_field_to_leg_linking",
        "region_local_end_char": 71,
        "region_local_start_char": 42,
        "rule_id": "missed_approach_instruction_span_regex_v8",
        "source": "ocr_text",
        "source_end_char": 94,
        "source_region": "MISSED_APPROACH_TEXT",
        "source_section": "missed_approach_text",
        "source_snippet": "turn to 2800 direct and hold.",
        "source_start_char": 65,
        "value": "turn to 2800 direct and hold."
      }
    ],
    "route_sequence_snippets": [],
    "track_to_fix_snippets": [],
    "turn_candidates": [
      {
        "confidence": 0.45,
        "field_type": "turn_direction",
        "global_end_char": 64,
        "global_start_char": 59,
        "notes": "other_chart_text_procedure_word_context",
        "region_local_end_char": 41,
        "region_local_start_char": 36,
        "rule_id": "turn_direction_regex_v8",
        "source": "ocr_text",
        "source_end_char": 64,
        "source_region": "MISSED_APPROACH_TEXT",
        "source_section": "missed_approach_text",
        "source_snippet": "MISSED APPROACH: APPROACH: Climbing right turn to 2800 direct and hold.",
        "source_start_char": 59,
        "value": "RIGHT"
      }
    ]
  },
  "leakage_policy": {
    "uses_canonical_target": false,
    "uses_cifp_or_arinc_424": false,
    "uses_expected_value": false,
    "uses_gold_field_to_leg_mapping": false,
    "uses_gold_observable_evidence": false,
    "uses_human_evidence_provenance": false,
    "uses_scorer_output": false
  },
  "region_profile": "TPD",
  "schema_version": "experiment5_roi_field_candidates_schema_v1",
  "source_contract": {
    "allows_canonical_target": false,
    "allows_chart_image_pixels": false,
    "allows_gold_observable_evidence": false,
    "allows_human_confirmed_roi": true,
    "allows_ocr_bbox": false,
    "source": "same_chart_human_confirmed_roi_ocr_text"
  }
}
